{
  "_fixture": true,
  "id": "FIX-MISION-001",
  "missionVersion": 6,
  "missionStatus": "huella",
  "arquetipo": "Reparacion",
  "intensidad": "telar_completo",
  "preparacion": "preparada",
  "origenes": [
    {
      "sistema": "Baserow",
      "tipoEntidad": "TAREA",
      "recordId": "FIX-TAREA-014",
      "versionOrigen": "v1",
      "leidoEn": "2026-09-02T09:00:00Z",
      "politicaEscritura": "solo_lectura"
    }
  ],
  "reformulacion": "¿Podemos evitar que el volumen de node_modules quede corrupto si `npm install` falla a mitad de una reinstalacion del contenedor del Spike?",
  "titulo": "Reinstalacion fallida deja node_modules a medias",
  "objetivo": "Que un fallo de red durante `docker compose up` no deje el contenedor en un estado que solo se arregla borrando el volumen a mano",
  "por_que_ahora": "Ocurrio una vez durante las pruebas del lobby -- no bloqueo nada, pero no quedo investigado",
  "afectados": ["Spike Concilio cooperativo", "Operador del VPS"],
  "personasConsultadas": [],
  "personasPendientesDeConsultar": [],
  "tension": "Arreglar bien (volumen separado + reintento con backoff) cuesta mas que un parche rapido (reintentar sin mas)",
  "criterio_rector": "mantenibilidad",
  "criterio_cierre": "Un fallo de red simulado durante `npm install` no deja el contenedor en estado irrecuperable sin intervencion manual",
  "restricciones": ["No tocar el candado anti-condicion-de-carrera ya verificado en produccion"],
  "consecuencia_de_esperar": "Bajo -- ya ocurrio una vez sin bloquear nada, pero podria coincidir con un reinicio real del VPS",
  "conocido": [
    "El volumen node_modules ya esta separado del bind mount de codigo",
    "package-lock.json SI estaba commiteado (confirmado en Relevo -- lo que estaba PENDIENTE_DE_COMPROBAR paso a VERIFICADO)"
  ],
  "faltantes": [],
  "reversibilidad": "reversible",
  "participantes": [
    { "actorId": "visitante-01", "participantType": "human", "roleId": "Visitante" },
    { "actorId": "acervo-tecnico", "participantType": "ai", "roleId": "Acervo Tecnico" },
    { "actorId": "acervo-logistico", "participantType": "ai", "roleId": "Acervo Logistico" }
  ],
  "contribuciones": [],
  "coste_estimado": 0.002,
  "coste_real": 0.0017,
  "resultado": {
    "objetivo": "Que un fallo de red durante la reinstalacion no deje el contenedor irrecuperable sin intervencion manual",
    "criterio_rector": "mantenibilidad",
    "accion_propuesta": "Cambiar `npm install --omit=dev` por `npm ci --omit=dev` en docker-compose.yml",
    "evidencia": "package-lock.json confirmado commiteado en Relevo",
    "riesgo_principal": "Ninguno tras confirmar el lockfile",
    "condicion_exito": "Un fallo de red simulado a mitad de instalacion no deja el contenedor en estado irrecuperable",
    "responsable": "Operador (Visitante), con Acervo Tecnico como apoyo",
    "reversibilidad": "reversible",
    "modo_comprobacion": "Simular un corte de red durante `docker compose up --force-recreate` y comprobar que un segundo intento se recupera solo",
    "hilosIncorporados": ["hecho: volumen ya separado (VERIFICADO)", "propuesta: npm ci con lockfile"],
    "hilosDescartados": [
      { "hiloId": "contribucion-acervo-logistico-001", "motivo": "Contrato invalido (ERR) -- no aporto contenido usable a este ciclo" }
    ]
  },
  "decision_humana": "aprobar",
  "consecuencia_verificada": "docker-compose.yml actualizado a `npm ci --omit=dev`; corte de red simulado dos veces seguidas, el contenedor se recupero solo en ambas",
  "memoria": [
    "El Spike ahora usa `npm ci` -- si se vuelve a tocar docker-compose.yml, recordar mantener el lockfile commiteado",
    "Acervo Logistico fallo su contrato en este ciclo -- revisar si el prompt necesita un ejemplo mas claro del campo 'propuestas'"
  ],
  "puerta": {
    "id": "PUERTA-FIX-001",
    "estado": "EJECUTADA_VERIFICADA",
    "efecto": "Modifica docker-compose.yml del Spike (comando de instalacion) y recrea el contenedor",
    "destino": "VPS -- tools/gobierno/spike_concilio_coop/docker-compose.yml",
    "datos": "Una linea: command de npm install a npm ci",
    "reversible": true,
    "versionInspeccionada": 4,
    "nivelRiesgo": "bajo_reversible"
  }
}
